{
  "version": "1.0",
  "status": "approved",
  "reviewer_id": "agent-verifier-02",
  "reviewed_at_utc": "2026-08-17T14:35:00Z",
  "intent_fingerprint": "0000000000000000000000000000000000000000000000000000000000000000",
  "findings": [
    "Example only: replace intent_fingerprint with the exact current fingerprint before using this review.",
    "Verified target and environment independently from the implementation agent."
  ]
}
